{"manifest":{"claims":{"claimed_at_us":1793092502500000,"run_id":"0123456789abcdef"},"result":{"environment":{"arch":"x86_64","fingerprint":"sha256:b3bad75a23bccc3e05cab514359422878a64dabb059753292538f5d41079472c"},"provenance":{"normalisation_version":1,"runner":"gitiup 0.1.0","tier":"simulated"},"source":{"commit":"sha1:aaaaaaaaaaaaaaaaaaaaaaaaaaaaaaaaaaaaaaaa","event":{"name":"push","payload":"sha256:b8e1f80bd70ae0784c7855a451731b745fddb67749d23f637be9082b75e9575b"},"workflow":{"oid":"sha1:bbbbbbbbbbbbbbbbbbbbbbbbbbbbbbbbbbbbbbbb","path":"ci.yml"}},"steps":[{"exit_code":0,"name":"run","outcome":"success","stderr":"sha256:e3b0c44298fc1c149afbf4c8996fb92427ae41e4649b934ca495991b7852b855","stdout":"sha256:762069bc07a6e1b5df123a5ae7bd91c10daa04694fbaa17fba0cd6a8dcce8f22"}]},"schema_version":1,"type":"https://gitiup.dev/attestation/run/1"},"payload_type":"application/vnd.gitiup.run-manifest+json","schema_version":1,"signatures":[{"algorithm":"ed25519","key_id":"SHA256:nlTU572wrqEfZGpFZmv3xmlgh82RqlvoDhNfxWFbS/w","public_key":"ssh-ed25519 AAAAC3NzaC1lZDI1NTE5AAAAIEdsIckgW08AT6JAIpQlCL53Vku/sjLOx+SMwZZgIMf+","sig":"kvUc7+2+be680QPQj7Y8NX8PzOzSP8qsp81kJ7vmluS9WvWhAcC0py2VJJcUkT4EMLvcuv3bj1zGnIJ+ZWMlBQ=="}]}