{"manifest":{"claims":{"claimed_at_us":1793092502500000,"run_id":"0123456789abcdef","timing":{"build":{"duration_us":3900000,"started_us":1793092502912000},"checkout":{"duration_us":412000,"started_us":1793092502500000}}},"result":{"environment":{"arch":"x86_64","fingerprint":"sha256:76217bf6264fed8da514bd68d07329af292a7f73a5e7e26077466259967fc603","image":{"digest":"sha256:3cafcfa89b212a186c2c2d4be67c3f248aaada2fe78e45bc61c804c15dc8bc54","reference":"ghcr.io/gitiup/ci:ubuntu-24.04"},"os":"linux","provider":"docker","toolchain":[{"name":"cargo","version":"1.99.1"},{"name":"rustc","version":"1.99.1"}]},"inputs":{"coverage":true,"jobs":4,"toolchain":"1.99.1"},"pins":{"actions/checkout@v4":{"commit":"sha1:cdcdcdcdcdcdcdcdcdcdcdcdcdcdcdcdcdcdcdcd","ref":"v4","repo":"actions/checkout"},"rust-actions/toolchain@v1":{"commit":"sha1:abababababababababababababababababababab","repo":"rust-actions/toolchain"}},"provenance":{"normalisation_version":1,"runner":"gitiup 0.1.0","sandbox":"docker","tier":"local"},"reusable_workflows":[{"oid":"sha1:2121212121212121212121212121212121212121","path":".github/workflows/_lint.yml"}],"secret_names":["CODECOV_TOKEN","NPM_TOKEN"],"source":{"commit":"sha1:aaaaaaaaaaaaaaaaaaaaaaaaaaaaaaaaaaaaaaaa","event":{"action":"synchronize","name":"pull_request","payload":"sha256:c85490dcbdd4312ab1a60117cf77ce65a513c25261bd41137636f1d06321a703"},"job":"build","matrix":{"os":"ubuntu-24.04"},"repo":"gitiup/gitiup","workflow":{"oid":"sha1:bbbbbbbbbbbbbbbbbbbbbbbbbbbbbbbbbbbbbbbb","path":".github/workflows/ci.yml"}},"steps":[{"exit_code":0,"id":"checkout","name":"Checkout","outcome":"success","outputs":{"commit":"abc123"},"stderr":"sha256:e3b0c44298fc1c149afbf4c8996fb92427ae41e4649b934ca495991b7852b855","stdout":"sha256:4fe4b7fe703aabd95d666b2e85d6d3e3ac19b144140a3f8f565e857e4c334b3e","uses":"actions/checkout@v4"},{"artifacts":[{"digest":"sha256:c9688d30352352f7e531a79916bb755b9f521df72815a18667e4201fefbf9ffe","name":"coverage.lcov","size_bytes":81920}],"exit_code":0,"id":"build","name":"cargo test","outcome":"success","outputs":{"coverage":"91.5"},"stderr":"sha256:e3b0c44298fc1c149afbf4c8996fb92427ae41e4649b934ca495991b7852b855","stdout":"sha256:5d8eb7fa9aaaad703c47ff874f31c1f362721b83011a53057a33547fdd867403"}]},"schema_version":1,"type":"https://gitiup.dev/attestation/run/1"},"payload_type":"application/vnd.gitiup.run-manifest+json","schema_version":1,"signatures":[{"algorithm":"ed25519","key_id":"SHA256:nlTU572wrqEfZGpFZmv3xmlgh82RqlvoDhNfxWFbS/w","public_key":"ssh-ed25519 AAAAC3NzaC1lZDI1NTE5AAAAIEdsIckgW08AT6JAIpQlCL53Vku/sjLOx+SMwZZgIMf+","sig":"LQcJk3aVYOeohXIgkYg3+vhhpiAk9PtMLvdRgxWE37ZVIPIpJ5+FNbOIfk+/ht3iZczSXhJaY/hW/zRbX6RvDg=="}]}