{"manifest":{"claims":{"claimed_at_us":1793092502500000,"run_id":"0123456789abcdef"},"result":{"environment":{"arch":"x86_64","fingerprint":"sha256:739504d7a82253354970c679e929e775465aa3d94e33f4391944233121db48f9","os":"linux","provider":"simulated"},"provenance":{"normalisation_version":1,"runner":"gitiup 0.1.0","sandbox":"none","tier":"simulated"},"source":{"commit":"sha1:aaaaaaaaaaaaaaaaaaaaaaaaaaaaaaaaaaaaaaaa","event":{"action":"synchronize","name":"pull_request","payload":"sha256:c85490dcbdd4312ab1a60117cf77ce65a513c25261bd41137636f1d06321a703"},"job":"build","matrix":{"os":"ubuntu-24.04"},"repo":"gitiup/gitiup","workflow":{"oid":"sha1:bbbbbbbbbbbbbbbbbbbbbbbbbbbbbbbbbbbbbbbb","path":".github/workflows/ci.yml"}},"steps":[{"exit_code":0,"id":"plan","name":"Plan the run","outcome":"success","stderr":"sha256:e3b0c44298fc1c149afbf4c8996fb92427ae41e4649b934ca495991b7852b855","stdout":"sha256:91d5a28903208128da506d87486295568cbae2f2c71e51e33a96cbd2ab43221c"}]},"schema_version":1,"type":"https://gitiup.dev/attestation/run/1"},"payload_type":"application/vnd.gitiup.run-manifest+json","schema_version":1,"signatures":[{"algorithm":"ed25519","key_id":"SHA256:nlTU572wrqEfZGpFZmv3xmlgh82RqlvoDhNfxWFbS/w","public_key":"ssh-ed25519 AAAAC3NzaC1lZDI1NTE5AAAAIEdsIckgW08AT6JAIpQlCL53Vku/sjLOx+SMwZZgIMf+","sig":"9eEAYZHiVuDYZoFAA4XhUxImhcuPHX8jjWQ5vJQmN64Yk6PfqKNqKZHaAa2ooz2ahhx7HH5OELs3SC2dHfaxAw=="}]}